{"k":"active_coherence_report","v":1,"generated_s":1792972800.0,"params":{"hop_s":2.0,"min_cell_windows":5,"isolation_min":0.5,"min_events":3,"min_no_go_species":2,"separate_msc":0.5,"coherent_msc":0.8,"coherent_phase_spread_deg":30.0,"bearing_dl_db":3.0,"duet_lag_samples":0.5,"event_gap_s":3.0},"input":{"coherence_records":15,"coherence_partial_skipped":1,"birds_rows":119,"excluded_human_voice":3,"events":14,"events_multi_beam":13,"events_overlapping":13},"measurability":{"verdict":"measurable","interval_s_p50":60.0,"event_s_p50":33.0,"event_windows_p50":16.5,"event_intervals":13,"isolating_event_intervals":10,"isolating_events":10,"species_ok":2,"species_insufficient":1},"rows":[{"species":"Barn Owl","band":5,"edges_hz":[2000,4000],"status":"ok","events":4,"intervals":4,"pair_samples":12,"windows":120,"msc_active":0.275,"msc_quiet":0.798,"msc_diff":-0.523,"ph_deg":0.0,"ph_spread_deg":40.0,"lag_abs":1.0,"dl_abs_db":4.0,"separates":true,"coherent":false,"bearing_dl":true,"duet_lag":true},{"species":"Eastern Screech-Owl","band":4,"edges_hz":[1000,2000],"status":"insufficient","events":2,"intervals":2,"pair_samples":6,"windows":60,"msc_active":0.275,"msc_quiet":0.798,"msc_diff":-0.523,"ph_deg":0.0,"ph_spread_deg":40.0,"lag_abs":1.0,"dl_abs_db":4.0,"separates":true,"coherent":false,"bearing_dl":true,"duet_lag":true},{"species":"Tufted Titmouse","band":6,"edges_hz":[4000,8000],"status":"ok","events":4,"intervals":4,"pair_samples":12,"windows":120,"msc_active":0.95,"msc_quiet":0.798,"msc_diff":0.152,"ph_deg":0.0,"ph_spread_deg":5.0,"lag_abs":2.0,"dl_abs_db":1.0,"separates":false,"coherent":true,"bearing_dl":false,"duet_lag":true}],"species":[{"species":"Barn Owl","events":4,"bands_ok":1,"beam_gated_classification":"go","level_ratio_bearing":"go","duet":"no_go"},{"species":"Eastern Screech-Owl","events":2,"bands_ok":0,"beam_gated_classification":"insufficient","level_ratio_bearing":"insufficient","duet":"insufficient"},{"species":"Tufted Titmouse","events":4,"bands_ok":1,"beam_gated_classification":"no_go","level_ratio_bearing":"no_go","duet":"go"}],"methods":{"beam_gated_classification":{"verdict":"go","go":["Barn Owl"],"no_go":["Tufted Titmouse"]},"level_ratio_bearing":{"verdict":"go","go":["Barn Owl"],"no_go":["Tufted Titmouse"]},"duet":{"verdict":"go","go":["Tufted Titmouse"],"no_go":["Barn Owl"]}}}
